O fármaco de Oxford produzido na Índia, aliás, tornou-se motivo de cobiça internacional.	O fármaco de Oxford produzido na Índia, aliás, tornou-se motivo de cobiça internacional.	0	False
Somente uma semana depois do previsto, na última sexta-feira, chegaram dois milhões de doses que o governo esperava.	Somente uma semana depois do previsto, na última sexta-feira, chegaram dois milhões de doses que o governo esperava.	0	False
Mesmo com esses endossos, as autoridades não conseguiram esconder os receios compartilhados por médicos em todo o país com relação à eficácia.	Mesmo com esses endossos, as autoridades não conseguiram esconder os receios compartilhados por médicos em todo o país com relação à eficácia.	0	False
Profissionais de saúde chegaram a ser ameaçados com cortes salariais pelas autoridades por se recusarem a receber a vacina.	Profissionais de saúde chegaram a ser ameaçados com cortes salariais pelas autoridades por se recusarem a receber a vacina.	0	False
Funcionários do Ministério da Saúde estão empenhados em promover a confiança nas vacinas e repreender pessoas que questionam a aprovação das vacinas.	Funcionários do Ministério da Saúde estão empenhados em promover a confiança nas vacinas e repreender pessoas que questionam a aprovação das vacinas.	0	False
Para que a pandemia se extinga, é preciso que a hesitação vacinal acabe.	Para que a pandemia se extinga, é preciso que a hesitação vacinal acabe.	0	False
